{
  "$schema": "./build.config.schema.json",
  "versionEnv": "GITVERSION_MAJORMINORPATCH",

  "projectGroups": {
    "packages": {
      "sourceDir": "dotnet/src",
      "action": "pack",
      "include": ["UnifyBuild.Nuke", "UnifyBuild.Tool"],
      "exclude": []
    }
  },

  "packIncludeSymbols": true,
  "packProperties": {
    "GeneratePackageOnBuild": "false"
  },
  "syncLocalNugetFeed": true,
  "localNugetFeedRoot": "C:\\lunar-horse\\packages\\nuget"
}
